{
  "version": 1,
  "toolVersion": "0.1.0",
  "createdAt": "2026-08-09T18:28:19Z",
  "privacy": "sanitized",
  "roots": [
    {
      "id": "desktop-steam-grid",
      "kind": "steam-grid",
      "fileCount": 429,
      "totalBytes": 547977388,
      "mediaCount": 427,
      "imageCount": 427,
      "extensions": {
        "ico": 4,
        "jpg": 72,
        "json": 2,
        "png": 351
      },
      "roles": {
        "grid": 98,
        "hero": 105,
        "icon": 34,
        "logo": 65,
        "portrait": 125
      },
      "dimensions": {
        "1024x1024": 3,
        "1067x1067": 1,
        "1096x404": 1,
        "1137x800": 1,
        "1157x403": 1,
        "1200x579": 1,
        "1200x628": 1,
        "1200x642": 1,
        "1200x727": 1,
        "1242x2208": 1,
        "12480x7857": 1,
        "1280x169": 1,
        "128x128": 2,
        "1409x444": 1,
        "1433x1136": 1,
        "1454x508": 1,
        "1486x597": 1,
        "1639x1164": 1,
        "1650x400": 1,
        "1750x539": 2,
        "1758x423": 1,
        "1806x429": 1,
        "1920x1080": 1,
        "1920x620": 61,
        "1979x585": 1,
        "2087x2121": 1,
        "2251x515": 1,
        "2328x699": 1,
        "2431x1083": 1,
        "2500x850": 1,
        "2518x1719": 1,
        "2534x986": 2,
        "256x256": 7,
        "2619x1121": 1,
        "2632x1240": 2,
        "2684x1277": 1,
        "2695x796": 1,
        "2710x1202": 1,
        "2806x990": 1,
        "2864x537": 1,
        "2909x2030": 1,
        "2952x732": 1,
        "300x450": 2,
        "3177x1584": 1,
        "3244x729": 1,
        "3279x546": 1,
        "32x32": 5,
        "3778x839": 1,
        "3840x1080": 1,
        "3840x1240": 38,
        "3840x697": 1,
        "3915x1537": 1,
        "460x215": 13,
        "4996x2798": 1,
        "512x512": 11,
        "5471x1280": 1,
        "600x375": 1,
        "600x900": 111,
        "623x210": 1,
        "636x87": 1,
        "640x360": 4,
        "6467x3019": 1,
        "64x64": 1,
        "660x930": 8,
        "6900x3000": 1,
        "691x665": 1,
        "700x313": 2,
        "708x247": 1,
        "797x434": 1,
        "830x580": 1,
        "834x834": 1,
        "920x430": 79,
        "9634x4834": 1,
        "984x277": 1,
        "993x259": 2
      }
    },
    {
      "id": "gaming-profiles",
      "kind": "decky-catalog",
      "fileCount": 434,
      "totalBytes": 547981267,
      "mediaCount": 427,
      "imageCount": 427,
      "extensions": {
        "ico": 4,
        "jpg": 72,
        "json": 4,
        "png": 351,
        "py": 1,
        "txt": 1
      },
      "roles": {
        "grid": 98,
        "hero": 105,
        "icon": 34,
        "logo": 65,
        "portrait": 125
      },
      "dimensions": {
        "1024x1024": 3,
        "1067x1067": 1,
        "1096x404": 1,
        "1137x800": 1,
        "1157x403": 1,
        "1200x579": 1,
        "1200x628": 1,
        "1200x642": 1,
        "1200x727": 1,
        "1242x2208": 1,
        "12480x7857": 1,
        "1280x169": 1,
        "128x128": 2,
        "1409x444": 1,
        "1433x1136": 1,
        "1454x508": 1,
        "1486x597": 1,
        "1639x1164": 1,
        "1650x400": 1,
        "1750x539": 2,
        "1758x423": 1,
        "1806x429": 1,
        "1920x1080": 1,
        "1920x620": 61,
        "1979x585": 1,
        "2087x2121": 1,
        "2251x515": 1,
        "2328x699": 1,
        "2431x1083": 1,
        "2500x850": 1,
        "2518x1719": 1,
        "2534x986": 2,
        "256x256": 7,
        "2619x1121": 1,
        "2632x1240": 2,
        "2684x1277": 1,
        "2695x796": 1,
        "2710x1202": 1,
        "2806x990": 1,
        "2864x537": 1,
        "2909x2030": 1,
        "2952x732": 1,
        "300x450": 2,
        "3177x1584": 1,
        "3244x729": 1,
        "3279x546": 1,
        "32x32": 5,
        "3778x839": 1,
        "3840x1080": 1,
        "3840x1240": 38,
        "3840x697": 1,
        "3915x1537": 1,
        "460x215": 13,
        "4996x2798": 1,
        "512x512": 11,
        "5471x1280": 1,
        "600x375": 1,
        "600x900": 111,
        "623x210": 1,
        "636x87": 1,
        "640x360": 4,
        "6467x3019": 1,
        "64x64": 1,
        "660x930": 8,
        "6900x3000": 1,
        "691x665": 1,
        "700x313": 2,
        "708x247": 1,
        "797x434": 1,
        "830x580": 1,
        "834x834": 1,
        "920x430": 79,
        "9634x4834": 1,
        "984x277": 1,
        "993x259": 2
      }
    },
    {
      "id": "playnite-extra-metadata",
      "kind": "playnite-extra",
      "fileCount": 88,
      "totalBytes": 51066655,
      "mediaCount": 88,
      "imageCount": 87,
      "extensions": {
        "mp4": 1,
        "png": 87
      },
      "roles": {
        "logo": 87,
        "video": 1
      },
      "dimensions": {
        "478x103": 1,
        "499x252": 1,
        "605x304": 1,
        "611x271": 1,
        "623x210": 1,
        "636x101": 1,
        "636x640": 1,
        "636x87": 1,
        "639x262": 1,
        "640x101": 1,
        "640x104": 1,
        "640x108": 1,
        "640x109": 2,
        "640x116": 2,
        "640x118": 1,
        "640x126": 2,
        "640x139": 1,
        "640x142": 1,
        "640x158": 1,
        "640x167": 1,
        "640x168": 1,
        "640x173": 1,
        "640x175": 1,
        "640x177": 1,
        "640x180": 1,
        "640x187": 1,
        "640x188": 1,
        "640x189": 1,
        "640x192": 2,
        "640x195": 1,
        "640x200": 1,
        "640x201": 1,
        "640x202": 2,
        "640x203": 1,
        "640x208": 1,
        "640x231": 1,
        "640x236": 1,
        "640x247": 1,
        "640x250": 1,
        "640x251": 1,
        "640x254": 1,
        "640x274": 1,
        "640x284": 1,
        "640x286": 1,
        "640x288": 1,
        "640x296": 1,
        "640x299": 1,
        "640x300": 1,
        "640x310": 1,
        "640x318": 1,
        "640x340": 1,
        "640x349": 1,
        "640x354": 1,
        "640x359": 1,
        "640x360": 1,
        "640x403": 1,
        "640x420": 1,
        "640x422": 1,
        "640x437": 1,
        "640x446": 2,
        "640x45": 1,
        "640x47": 1,
        "640x49": 1,
        "640x52": 1,
        "640x53": 1,
        "640x533": 1,
        "640x589": 1,
        "640x607": 1,
        "640x63": 1,
        "640x68": 1,
        "640x69": 1,
        "640x73": 1,
        "640x75": 1,
        "640x82": 1,
        "640x83": 1,
        "640x84": 1,
        "640x85": 1,
        "640x91": 2,
        "640x93": 1,
        "640x96": 1
      }
    },
    {
      "id": "playnite-library-files",
      "kind": "playnite-library-files",
      "fileCount": 267,
      "totalBytes": 92227650,
      "mediaCount": 267,
      "imageCount": 267,
      "extensions": {
        "ico": 82,
        "jpg": 176,
        "png": 9
      },
      "dimensions": {
        "1004x565": 4,
        "1004x567": 1,
        "1004x569": 1,
        "1004x570": 19,
        "1004x626": 5,
        "1298x809": 2,
        "1438x809": 1,
        "1438x810": 32,
        "1438x811": 1,
        "1440x900": 1,
        "150x150": 9,
        "1530x1080": 1,
        "1920x1080": 1,
        "1920x620": 15,
        "1920x880": 1,
        "32x32": 1,
        "600x800": 55,
        "600x900": 3,
        "640x297": 1,
        "640x853": 1,
        "684x912": 1,
        "700x933": 1,
        "720x960": 2,
        "740x1080": 1,
        "756x1008": 1,
        "762x1015": 1,
        "767x1023": 1,
        "800x1067": 1,
        "809x1080": 1,
        "810x1080": 20
      }
    }
  ],
  "duplicateSummary": {
    "groups": 388,
    "copies": 865,
    "excessBytes": 628250723,
    "crossRootGroups": 386,
    "uniqueFileHashes": 741
  },
  "issues": [
    {
      "rootId": "gaming-profiles",
      "code": "media-type-mismatch",
      "message": ".png content has MIME image/webp, expected image/png"
    },
    {
      "rootId": "gaming-profiles",
      "code": "media-type-mismatch",
      "message": ".png content has MIME image/webp, expected image/png"
    },
    {
      "rootId": "gaming-profiles",
      "code": "media-type-mismatch",
      "message": ".png content has MIME image/webp, expected image/png"
    },
    {
      "rootId": "gaming-profiles",
      "code": "media-type-mismatch",
      "message": ".png content has MIME image/webp, expected image/png"
    },
    {
      "rootId": "gaming-profiles",
      "code": "media-type-mismatch",
      "message": ".png content has MIME image/webp, expected image/png"
    },
    {
      "rootId": "gaming-profiles",
      "code": "media-type-mismatch",
      "message": ".png content has MIME image/webp, expected image/png"
    },
    {
      "rootId": "gaming-profiles",
      "code": "media-type-mismatch",
      "message": ".png content has MIME image/webp, expected image/png"
    },
    {
      "rootId": "gaming-profiles",
      "code": "media-type-mismatch",
      "message": ".png content has MIME image/webp, expected image/png"
    },
    {
      "rootId": "gaming-profiles",
      "code": "media-type-mismatch",
      "message": ".png content has MIME image/webp, expected image/png"
    },
    {
      "rootId": "gaming-profiles",
      "code": "media-type-mismatch",
      "message": ".png content has MIME image/webp, expected image/png"
    },
    {
      "rootId": "gaming-profiles",
      "code": "media-type-mismatch",
      "message": ".png content has MIME image/webp, expected image/png"
    },
    {
      "rootId": "gaming-profiles",
      "code": "media-type-mismatch",
      "message": ".png content has MIME image/webp, expected image/png"
    },
    {
      "rootId": "desktop-steam-grid",
      "code": "media-type-mismatch",
      "message": ".png content has MIME image/webp, expected image/png"
    },
    {
      "rootId": "desktop-steam-grid",
      "code": "media-type-mismatch",
      "message": ".png content has MIME image/webp, expected image/png"
    },
    {